Time,F_Scale,Location,County,State,Lat,Lon,Comments
1312,UNK,1 W WATSON,LIVINGSTON,LA,30.58,-90.97,A FEW TREES DOWN ALONG BEND ROAD IN WATSON. LIKELY TORNADO. (LIX)
1314,UNK,1 NNE WATSON,LIVINGSTON,LA,30.59,-90.95,LIKELY TORNADO DAMAGE ALONG FORE RD...LA HWY 1022...POWER LINES DOWN AND LAW ENFORCEMENT ON SITE. (LIX)
1317,UNK,4 NNE WATSON,LIVINGSTON,LA,30.63,-90.93,LIKELY TORNADO DAMAGE ALONG SIMS ROAD NORTH OF WATSON. (LIX)
1533,UNK,8 ESE BATON ROUGE,EAST BATON ROUGE,LA,30.4,-91,MULTIPLE REPORTS OF DAMAGE AROUND ANTIOCH AND TIGER BEND ROADS. EYEWITNESS REPORTS OF ROTATION AS WELL. LIKELY TORNADO. (LIX)
1945,UNK,2 W HINKLES FERRY,BRAZORIA,TX,28.95,-95.58,TORNADO REPORTED AT CR 310 FM 2611. (HGX)
