Time,F-Scale,Location,County,State,Lat,Lon,Comments
2040,UNK,1 S MAYVILLE,CHAUTAUQUA,NY,42.24,-79.5,PUBLIC REPORTED POSSIBLE TORNADO. AT LEAST ONE HOUSE HIT.WIRES DOWN. (BUF)
2048,UNK,1 S MAYVILLE,CHAUTAUQUA,NY,42.24,-79.5,EMERGENCY MANAGER REPORTED TORNADO ON GROUND (BUF)
2125,UNK,GREAT VALLEY,CATTARAUGUS,NY,42 21,-78.64,NY STATE POLICE AERIAL SURVEY CONFIRMS F1 TORNADO (BUF)
2126,UNK,1 WSW RANDOLPH,CATTARAUGUS,NY,42.16,-78.99,LARGE TREES DOWN ON MAIN STREET AND ON HOMES. PARTIAL ROOF DAMAGE. GAS PUMPS BLOWN OVER AT SUGAR CREEK STORE. SEMI TRUCK TIPPED OVER. (BUF)
2149,UNK,CARROLLTON,CATTARAUGUS,NY,42.11,-78.65,NUMEROUS TREES DOWN (BUF)
2310,UNK,1 S GALETON,POTTER,PA,41.72,-77.64,EMA REPORTS THAT GALETON FIRE CHIEF REPORTS NUMEROUS TREES DOWN OVER THE WEST BRANCH ROAD. THEY ARE WAITING FOR CREWS TO OPEN ROAD UP SO THEY CAN ASSESS DAMAGE. THE DAM (CTP)
2345,UNK,5 SW MORRIS,TIOGA,PA,41.6,-77.34,NUMEROUS TREES AND POWER POLES SNAPPED OFF NEAR THE JUNCTION OF WILSON HILL ROAD AND ROUTE 414. (CTP)
